Title,para,icon,link
EXCLUSIVE SERVICES,"Get single-stop solutions for all your digital marketing needs. We provide comprehensive services for SEO, web development, and much more.",,
Website Design,"Improve your web presence and engagement with the help of unique, clean, and creative web design.",desktop,web-designing
Web Development,We make use of open source technologies for building websites that ignite your business and elevate your brand.,code,web-development
UIUX Engineering,"Our aim is to create intuitive and seamless user interface to make your site, app, or e-commerce store stand out.",object-group,ui-engineering
Joomla Development,Joomla is a popular open-source content management system and a user-friendly way of building your website.,joomla,cms-development
Digital Marketing,"We provide comprehensive internet marketing services ranging from SEO, PPC, SMM, content, and much more",globe,digital-marketing
Content Writing,"Content is King! Get high-quality, engaging, and SEO-friendly content for your website and boost its ranking.",edit,content-writing
CMS Development,"Content Management System is an interface which lets you create, modify, and publish digital content directly to the web.",th-large,cms-development
MVC Development,Model-View-Controller is a popular industry-standard web development technique used to develop modern user interfaces.,lock,mvc-development
Magento Development,"Magento is an e-commerce platform based on open-source technology, and it is a popular choice of many.",magento,cms-development
Ecommerce Development,We offer custom eCommerce website design and development with improved functionality to engage target customers.,cart-plus,ecommerce-development
Wordpress Development,"Wordpress is a highly secure, economical, and smooth open-source CMS (Content Management System) based on PHP",wordpress,cms-development
WooCommerce Development,"WooCommerce is a free, fully customizable, and open-source e-commerce plugin made for WordPress.",wordpress-simple,cms-development
Drupal Development,Build outstanding digital experience with the popular and highly customizable open-source CMS platform.,drupal,cms-development
Core Development,Core is a popular open-source framework for web development that uses state-of-the-art web standards.,file-code-o,custom-development
